{
  "contract_type": "RiskAssessmentDecision",
  "schema_version": "1.0.0",
  "workflow_id": "wf_01",
  "correlation_id": "corr_01",
  "causation_id": "evt_07",
  "timestamp_utc": "2026-04-08T10:16:10Z",
  "originator": {
    "type": "agent",
    "id": "risk_governor_agent"
  },
  "environment": "prod",
  "operating_mode": "MODE-003",
  "payload": {
    "risk_decision_id": "risk_01",
    "proposal_id": "prop_01",
    "decision": "APPROVE_WITH_LIMITS",
    "reasons": [
      "Portfolio correlation acceptable",
      "Position size reduced due to elevated volatility percentile"
    ],
    "limit_constraints": [
      {
        "constraint_type": "max_size",
        "value": {
          "volume_lots": 0.30
        }
      },
      {
        "constraint_type": "max_deviation",
        "value": {
          "points": 8
        }
      }
    ],
    "risk_metrics_snapshot": {
      "var_95": 0.024,
      "expected_shortfall_95": 0.031,
      "exposure_pct": 0.07,
      "correlation_score": 0.44
    },
    "freshness_expiry": "2026-04-08T10:16:40Z",
    "policy_version": "risk_policy_3.2.1",
    "formula_version": "risk_formula_1.4.0",
    "provenance_bundle_ref": {
      "bundle_id": "prov_01",
      "account_snapshot_ref": "acctsnap_101",
      "market_snapshot_ref": "mktsnap_455"
    },
    "approval_token": "token_abc123"
  }
}
